"Authors","Author full names","Author(s) ID","Title","Year","Source title","Volume","Issue","Art. No.","Page start","Page end","Cited by","DOI","Link","Abstract","Document Type","Publication Stage","Open Access","Source","EID"
"Huckvale K.; Hoon L.; Stech E.; Newby J.M.; Zheng W.Y.; Han J.; Vasa R.; Gupta S.; Barnett S.; Senadeera M.; Cameron S.; Kurniawan S.; Agarwal A.; Kupper J.F.; Asbury J.; Willie D.; Grant A.; Cutler H.; Parkinson B.; Ahumada-Canale A.; Beames J.R.; Logothetis R.; Bautista M.; Rosenberg J.; Shvetcov A.; Quinn T.; MacKinnon A.; Rana S.; Tran T.; Rosenbaum S.; Mouzakis K.; Werner-Seidler A.; Whitton A.; Venkatesh S.; Christensen H.","Huckvale, Kit (34976592100); Hoon, Leonard (36668665700); Stech, Eileen (57194136821); Newby, Jill M (36904822100); Zheng, Wu Yi (57195301261); Han, Jin (57189047780); Vasa, Rajesh (14632834200); Gupta, Sunil (57211220698); Barnett, Scott (56890458900); Senadeera, Manisha (57220323558); Cameron, Stuart (57216348854); Kurniawan, Stefanus (58059538300); Agarwal, Akash (57694767800); Kupper, Joost Funke (58059538400); Asbury, Joshua (58059626800); Willie, David (58059538500); Grant, Alasdair (58059538600); Cutler, Henry (55181563500); Parkinson, Bonny (45761481500); Ahumada-Canale, Antonio (57209454634); Beames, Joanne R (57105395800); Logothetis, Rena (58059363900); Bautista, Marya (58059364000); Rosenberg, Jodie (57220856614); Shvetcov, Artur (57212486678); Quinn, Thomas (56453876600); MacKinnon, Andrew (7101756037); Rana, Santu (24829860700); Tran, Truyen (56948264600); Rosenbaum, Simon (45761309400); Mouzakis, Kon (23094814200); Werner-Seidler, Aliza (22952586300); Whitton, Alexis (36877031100); Venkatesh, Svetha (56204854900); Christensen, Helen (7401664450)","34976592100; 36668665700; 57194136821; 36904822100; 57195301261; 57189047780; 14632834200; 57211220698; 56890458900; 57220323558; 57216348854; 58059538300; 57694767800; 58059538400; 58059626800; 58059538500; 58059538600; 55181563500; 45761481500; 57209454634; 57105395800; 58059363900; 58059364000; 57220856614; 57212486678; 56453876600; 7101756037; 24829860700; 56948264600; 45761309400; 23094814200; 22952586300; 36877031100; 56204854900; 7401664450","Protocol for a bandit-based response adaptive trial to evaluate the effectiveness of brief self-guided digital interventions for reducing psychological distress in university students: the Vibe Up study","2023","BMJ Open","13","4","e066249","","","17","10.1136/bmjopen-2022-066249","https://www.scopus.com/pages/publications/85158877000?origin=resultslist","Introduction Meta-analytical evidence confirms a range of interventions, including mindfulness, physical activity and sleep hygiene, can reduce psychological distress in university students. However, it is unclear which intervention is most effective. Artificial intelligence (AI)-driven adaptive trials may be an efficient method to determine what works best and for whom. The primary purpose of the study is to rank the effectiveness of mindfulness, physical activity, sleep hygiene and an active control on reducing distress, using a multiarm contextual bandit-based AI-adaptive trial method. Furthermore, the study will explore which interventions have the largest effect for students with different levels of baseline distress severity. Methods and analysis The Vibe Up study is a pragmatically oriented, decentralised AI-adaptive group sequential randomised controlled trial comparing the effectiveness of one of three brief, 2-week digital self-guided interventions (mindfulness, physical activity or sleep hygiene) or active control (ecological momentary assessment) in reducing self-reported psychological distress in Australian university students. The adaptive trial methodology involves up to 12 sequential mini-trials that allow for the optimisation of allocation ratios. The primary outcome is change in psychological distress (Depression, Anxiety and Stress Scale, 21-item version, DASS-21 total score) from preintervention to postintervention. Secondary outcomes include change in physical activity, sleep quality and mindfulness from preintervention to postintervention. Planned contrasts will compare the four groups (ie, the three intervention and control) using self-reported psychological distress at prespecified time points for interim analyses. The study aims to determine the best performing intervention, as well as ranking of other interventions. Ethics and dissemination Ethical approval was sought and obtained from the UNSW Sydney Human Research Ethics Committee (HREC A, HC200466). A trial protocol adhering to the requirements of the Guideline for Good Clinical Practice was prepared for and approved by the Sponsor, UNSW Sydney (Protocol number: HC200466_CTP). Trial registration number ACTRN12621001223820.  © 2023 BMJ Publishing Group. All rights reserved.","Article","Final","All Open Access; Gold Open Access; Green Open Access","Scopus","2-s2.0-85158877000"
"Krittanawong C.","Krittanawong, Chayakrit (57188642415)","57188642415","Artificial Intelligence in Clinical Practice: How AI Technologies Impact Medical Research and Clinics","2023","Artificial Intelligence in Clinical Practice: How AI Technologies Impact Medical Research and Clinics","","","","1","522","9","10.1016/C2022-0-00161-6","https://www.scopus.com/pages/publications/85176834339?origin=resultslist","Artificial Intelligence in Clinical Practice: How AI Technologies Impact Medical Research and Clinics compiles current research on Artificial Intelligence within medical subspecialties, helping practitioners with diagnosis, clinical decision-making, disease prediction, prevention, and the facilitation of precision medicine. The book defines the basic concepts of big data and AI in medicine and highlights current applications, challenges, ethical issues, and biases. Each chapter discusses AI applied to a specific medical subspecialty, including primary care, preventive medicine, general internal medicine, radiology, pathology, infectious disease, gastroenterology, cardiology, hematology, oncology, dermatology, ophthalmology, mental health, neurology, pulmonary, critical care, rheumatology, surgery, and OB-GYN. This is a valuable resource for clinicians, students, researchers and members of medical and biomedical fields who are interested in learning more about artificial intelligence technologies and their applications in medicine. © 2024 Elsevier Inc. All rights reserved.","Book","Final","","Scopus","2-s2.0-85176834339"
"Zheng W.Y.; Shvetcov A.; Slade A.; Jenkins Z.; Hoon L.; Whitton A.; Logothetis R.; Ravindra S.; Kurniawan S.; Gupta S.; Huckvale K.; Stech E.; Agarwal A.; Kupper J.F.; Cameron S.; Rosenberg J.; Manoglou N.; Senadeera M.; Venkatesh S.; Mouzakis K.; Vasa R.; Christensen H.; Newby J.M.","Zheng, Wu Yi (57195301261); Shvetcov, Artur (57212486678); Slade, Aimy (58613338800); Jenkins, Zoe (57195494677); Hoon, Leonard (36668665700); Whitton, Alexis (36877031100); Logothetis, Rena (58059363900); Ravindra, Smrithi (59515233800); Kurniawan, Stefanus (58059538300); Gupta, Sunil (57211220698); Huckvale, Kit (34976592100); Stech, Eileen (57194136821); Agarwal, Akash (57694767800); Kupper, Joost Funke (58059538400); Cameron, Stuart (57216348854); Rosenberg, Jodie (57220856614); Manoglou, Nicholas (59514653500); Senadeera, Manisha (57220323558); Venkatesh, Svetha (56204854900); Mouzakis, Kon (23094814200); Vasa, Rajesh (14632834200); Christensen, Helen (7401664450); Newby, Jill M. (36904822100)","57195301261; 57212486678; 58613338800; 57195494677; 36668665700; 36877031100; 58059363900; 59515233800; 58059538300; 57211220698; 34976592100; 57194136821; 57694767800; 58059538400; 57216348854; 57220856614; 59514653500; 57220323558; 56204854900; 23094814200; 14632834200; 7401664450; 36904822100","Recruiting Young People for Digital Mental Health Research: Lessons From an AI-Driven Adaptive Trial","2025","Journal of Medical Internet Research","27","","e60413","","","2","10.2196/60413","https://www.scopus.com/pages/publications/85215131240?origin=resultslist","Background: With increasing adoption of remote clinical trials in digital mental health, identifying cost-effective and time-efficient recruitment methodologies is crucial for the success of such trials. Evidence on whether web-based recruitment methods are more effective than traditional methods such as newspapers, media, or flyers is inconsistent. Here we present insights from our experience recruiting tertiary education students for a digital mental health artificial intelligence–driven adaptive trial—Vibe Up. Objective: We evaluated the effectiveness of recruitment via Facebook and Instagram compared to traditional methods for a treatment trial and compared different recruitment methods’ retention rates. With recruitment coinciding with COVID-19 lockdowns across Australia, we also compared the cost-effectiveness of social media recruitment during and after lockdowns. Methods: Recruitment was completed for 2 pilot trials and 6 minitrials from June 2021 to May 2022. To recruit participants, paid social media advertising on Facebook and Instagram was used, alongside mailing lists of university networks and student organizations or services, media releases, announcements during classes and events, study posters or flyers on university campuses, and health professional networks. Recruitment data, including engagement metrics collected by Meta (Facebook and Instagram), advertising costs, and Qualtrics data on recruitment methods and survey completion rates, were analyzed using RStudio with R (version 3.6.3; R Foundation for Statistical Computing). Results: In total, 1314 eligible participants (aged 22.79, SD 4.71 years; 1079, 82.1% female) were recruited to 2 pilot trials and 6 minitrials. The vast majority were recruited via Facebook and Instagram advertising (n=1203; 92%). Pairwise comparisons revealed that the lead institution’s website was more effective in recruiting eligible participants than Facebook (z=3.47; P=.003) and Instagram (z=4.23; P<.001). No differences were found between recruitment methods in retaining participants at baseline, at midpoint, and at study completion. Wilcoxon tests found significant differences between lockdown (pilot 1 and pilot 2) and postlockdown (minitrials 1-6) on costs incurred per link click (lockdown: median Aus $0.35 [US $0.22], IQR Aus $0.27-$0.47 [US $0.17-$0.29]; postlockdown: median Aus $1.00 [US $0.62], IQR Aus $0.70-$1.47 [US $0.44-$0.92]; W=9087; P<.001) and the amount spent per hour to reach the target sample size (lockdown: median Aus $4.75 [US $2.95], IQR Aus $1.94-6.34 [US $1.22-$3.97]; postlockdown: median Aus $13.29 [US $8.26], IQR Aus $4.70-25.31 [US $2.95-$15.87]; W=16044; P<.001). Conclusions: Social media advertising via Facebook and Instagram was the most successful strategy for recruiting distressed tertiary students into this artificial intelligence–driven adaptive trial, providing evidence for the use of this recruitment method for this type of trial in digital mental health research. No recruitment method stood out in terms of participant retention. Perhaps a reflection of the added distress experienced by young people, social media recruitment during the COVID-19 lockdown period was more cost-effective. ©Wu Yi Zheng, Artur Shvetcov, Aimy Slade, Zoe Jenkins, Leonard Hoon, Alexis Whitton, Rena Logothetis, Smrithi Ravindra, Stefanus Kurniawan, Sunil Gupta, Kit Huckvale, Eileen Stech, Akash Agarwal, Joost Funke Kupper, Stuart Cameron, Jodie Rosenberg, Nicholas Manoglou, Manisha Senadeera, Svetha Venkatesh, Kon Mouzakis, Rajesh Vasa, Helen Christensen, Jill M Newby.","Article","Final","All Open Access; Gold Open Access; Green Open Access","Scopus","2-s2.0-85215131240"
"Alshammari S.A.; Alyousefi N.A.; Almeneessier A.","Alshammari, Sulaiman A. (57523252400); Alyousefi, Nada A. (55890031000); Almeneessier, Aljohara (55343247800)","57523252400; 55890031000; 55343247800","Shaping tomorrow’s professionals: King Saud University’s transformative course on medical volunteerism, empowering students to develop proposals for impactful initiatives","2025","BMC Medical Education","25","1","1397","","","0","10.1186/s12909-025-07913-1","https://www.scopus.com/pages/publications/105018398251?origin=resultslist","Background: Volunteer healthcare is crucial in medical education, promoting empathy, leadership, and civic responsibility. King Saud University’s Health Volunteer Project integrates volunteerism into coursework and helps students create structured proposals to address healthcare challenges. Objectives: The primary objective was to evaluate the effectiveness of the Health Volunteer Project by Medical Students in developing professional skills and addressing healthcare service gaps. The secondary objectives were to assess the program’s broader impact, identify areas for improvement, and explore its potential for replication in other educational and healthcare settings. Methods: This initiative was embedded in the professionalism course and combined lectures, interactive group work, and poster presentations. Students were divided into groups of approximately ten members and asked to design health volunteer proposals using a standardized template provided through the university’s learning management system. Each proposal included objectives, target population, methods, anticipated outcomes, resources, and potential barriers. Proposals were summarized into posters, exhibited at an annual event, and evaluated using a structured scoring tool by faculty reviewers. Visitors (students and faculty) were invited to provide feedback through QR codes. This study followed a descriptive cross-sectional design. Data from 88 proposals submitted between 2022 and 2024 were analyzed to identify thematic trends, implementation strategies, and challenges encountered. Results: Analysis revealed an increasing reliance on technology in volunteer health initiatives. Proposals varied slightly over three years (31 in 2022, 28 in 2023, and 29 in 2024). Thematic focus evolved from non-communicable disease (NCD) awareness, mental health, and first aid in 2022 to mental health, disease prevention, and health technology in 2023, and artificial intelligence (AI)-driven innovations in 2024. Target audiences expanded from the public to vulnerable groups, families, and healthcare students. Strategies progressed from educational campaigns to digital platforms, mobile applications, wearable technologies, and virtual platforms. Outcomes shifted from awareness campaigns in 2022 to technology adoption and measurable patient outcomes by 2024, despite challenges such as funding and technical barriers. Notable projects included colorectal cancer awareness, attention-deficit/hyperactivity disorder (ADHD) education, and AI-based health solutions. Conclusion: Integrating volunteerism into medical education fosters professional development while addressing societal health needs. Student-led proposals demonstrate adaptability, innovation, and alignment with Vision 2030 priorities. Further research is warranted to evaluate the long-term impact, feasibility, and scalability of such initiatives. © The Author(s) 2025.","Article","Final","All Open Access; Gold Open Access; Green Open Access","Scopus","2-s2.0-105018398251"
"Chaika Y.A.; Baranov M.L.","Chaika, Yuliya A. (59676272800); Baranov, Maksim L. (58120806500)","59676272800; 58120806500","Prevalence of mental disorders among students and contemporary approaches to their prevention","2025","Obozrenie Psihiatrii i Medicinskoj Psihologii Imeni V.M. Bekhtereva","59","3","","25","39","2","10.31363/2313-7053-2025-3-1086","https://www.scopus.com/pages/publications/105017543462?origin=resultslist","This scientific review addresses the critical issue of high prevalence of mental disorders among university students, which negatively impacts their academic performance, quality of life, and future well-being. Consequently, the necessity of this research is driven by the growing need to develop effective prevention and intervention strategies. The aim of the article is to present a comprehensive description of the prevalence of various mental disorders among students, explore associated risk factors, successful treatment methods and prevention approaches. The review aims to create an overall picture of the problem, identify knowledge gaps, and determine promising directions for further research. The research methodology includes analysis of data from scientific publications indexed in databases such as E-library, PubMed, Scopus, and MedLine, using keywords: “mental disorders,” “students,” “depression,” “anxiety,” “prevention,” “treatment.” As a result of analyzing 63 publications in Russian and English over the past 8 years, the most common disorders were identified. The review included epidemiological studies examining the prevalence of depression, anxiety disorders, sleep disorders, substance abuse, suicidal behavior, Internet addiction, and other psychiatric disorders. The analysis covers data on prevalence, risk factors, and effectiveness of various treatment and prevention methods, including the application of psychotherapy and digital technologies. In particular, the potential of mobile applications, web-based interventions, and artificial intelligence tools is examined. Additionally, the analysis includes interdisciplinary approaches. In conclusion, the high prevalence of mental disorders among students presents a serious problem requiring a holistic approach. Digital technologies and interdisciplinary approaches demonstrate certain potential but require further development and optimization to enhance the effectiveness of prevention, early detection, and treatment. © 2025, FSBI V M Bekhterev National Research Medical Center for Psychiatry and Neurology of of the Russian Federation Ministry of Health. All rights reserved.","Review","Final","All Open Access; Gold Open Access; Green Open Access","Scopus","2-s2.0-105017543462"
"Adnan M.M.; Alkhafaij M.A.; Muhsin O.; Tabaan N.K.","Adnan, Myasar Mundher (57221874677); Alkhafaij, Mahdi Abdulkhudur (58816386500); Muhsin, Omar (59294987000); Tabaan, Noor K. (59705192100)","57221874677; 58816386500; 59294987000; 59705192100","Evaluating the Impact of IoT and AI-Based Health Education on Students' Knowledge and Behavior","2024","2nd International Conference on Emerging Research in Computational Science, ICERCS 2024","","","","","","0","10.1109/ICERCS63125.2024.10894896","https://www.scopus.com/pages/publications/105000787529?origin=resultslist","The knowledge and good behaviour that can be instilled in students are important for their physical, mental, emotional, and social health in the face of emerging infectious diseases. Traditional health education methods fall short of the levels of engagement and personalization needed for the increasingly dispersed populations in modern times. In this respect, IoT and AI present exciting new opportunities for meaningful health education tailored to the needs of the students. The research will bridge the gap by examining how IoT- and AI-driven health education can improve students' infectious disease prevention awareness and behaviour. In this research, an IoT- and AI-enabled health education framework has been developed that uses health education-based multiple linear regression (HE-MLR) analysis to determine the impact factor on students' knowledge and behaviour regarding infectious diseases. IoT-enabled health surveillance systems provide feedback, interactive content, and guidance on best practices in preventive health to students in real-time. In this regard, the proposed HE-MLR technique evaluates the effectiveness of IoT and AI-based health education in bringing behavioural change related to respiratory infectious diseases among targeted students. To that end, one more DID analysis is used to estimate the overall impact of the proposed interventions on students' health behaviours. These findings support that IoT- and AI-enhanced health education significantly improves students' knowledge, attitudes, and actions toward healthier practices. Other factors such as seminars, visual aids, and interactive media enhance the health messages. Thus, HE-MLR serves as a viable model for creating better health outcomes for students. © 2024 IEEE.","Conference paper","Final","","Scopus","2-s2.0-105000787529"
"Zhou X.; Sui H.; Guo Y.; Zou Z.","Zhou, Xuan (59934452100); Sui, Huajie (56198406500); Guo, Yuhong (59934272200); Zou, Ziyi (59933907700)","59934452100; 56198406500; 59934272200; 59933907700","The Application and Reflection of Artificial Intelligence in University Psychological Counseling","2025","Proceedings of 2025 5th International Conference on Bioinformatics and Intelligent Computing, BIC 2025","","","","498","502","0","10.1145/3724979.3725056","https://www.scopus.com/pages/publications/105007512711?origin=resultslist","In recent years, mental health issues among college students have been on the rise, with frequent concerns such as anxiety, depression, and heightened stress. As a result, there is an increasing interest in and demand for psychological guidance and counseling. Issues related to mental wellness are particularly common during adolescence and are beginning to affect younger demographics more frequently. Among individuals aged 18-24, the risk of depression has been detected at a rate of 24.1%. The college years represent a crucial phase in student development, characterized by academic demands, social hurdles, and shifts in self-awareness, all of which can significantly influence mental well-being. As such, it is becoming ever more crucial for colleges to prioritize the prevention of mental health challenges among their students and to offer counseling and therapeutic services. This paper delves into the significance of psychological counseling alongside the foundational concepts of artificial intelligence. By analyzing data from a sample of 566 college students, it utilizes t-tests and chi-square analyses to investigate the current implementation of AI in psychological counseling. Utilizing machine learning techniques in conjunction with predictive models powered by big data and AI algorithms, the study organizes and processes fundamental student information. Chi-square analyses are employed to explore the links between different mental health dimensions and personal characteristics, providing colleges with insights for assessing and supporting students' mental well-being. © 2025 Copyright held by the owner/author(s).","Conference paper","Final","","Scopus","2-s2.0-105007512711"
